Title,ArXiv Link,Paper Date,Date Added
EvoAgent - Towards Automatic Multi-Agent Generation via Evolutionary Algorithms,https://arxiv.org/abs/2406.14228,2024-06-20,2024-06-25
"Evaluation of Deep Learning Semantic Segmentation for Land Cover Mapping on Multispectral, Hyperspectral and High Spatial Aerial Imagery",https://arxiv.org/abs/2406.14220,2024-06-20,2024-06-25
Proving Olympiad Algebraic Inequalities without Human Demonstrations,https://arxiv.org/abs/2406.14219,2024-06-20,2024-06-25
Defending Against Sophisticated Poisoning Attacks with RL-based Aggregation in Federated Learning,https://arxiv.org/abs/2406.14217,2024-06-20,2024-06-25
REVEAL-IT - REinforcement learning with Visibility of Evolving Agent poLicy for InTerpretability,https://arxiv.org/abs/2406.14214,2024-06-20,2024-06-25
Complexity of Symbolic Representation in Working Memory of Transformer Correlates with the Complexity of a Task,https://arxiv.org/abs/2406.14213,2024-06-20,2024-06-25
Self-Supervised Pretext Tasks for Alzheimer's Disease Classification using 3D Convolutional Neural Networks on Large-Scale Synthetic Neuroimaging Dataset,https://arxiv.org/abs/2406.14210,2024-06-20,2024-06-25
SeCoKD - Aligning Large Language Models for In-Context Learning with Fewer Shots,https://arxiv.org/abs/2406.14208,2024-06-20,2024-06-25
LayerMatch - Do Pseudo-labels Benefit All Layers?,https://arxiv.org/abs/2406.14207,2024-06-20,2024-06-25
On the Representational Capacity of Neural Language Models with Chain-of-Thought Reasoning,https://arxiv.org/abs/2406.14197,2024-06-20,2024-06-25
Timo - Towards Better Temporal Reasoning for Language Models,https://arxiv.org/abs/2406.14192,2024-06-20,2024-06-25
Temporal Knowledge Graph Question Answering - A Survey,https://arxiv.org/abs/2406.14191,2024-06-20,2024-06-25
In Tree Structure Should Sentence Be Generated,https://arxiv.org/abs/2406.14189,2024-06-20,2024-06-25
Latent Functional Maps,https://arxiv.org/abs/2406.14183,2024-06-20,2024-06-25
SimulSeamless - FBK at IWSLT 2024 Simultaneous Speech Translation,https://arxiv.org/abs/2406.14177,2024-06-20,2024-06-25
A Multi-Stream Fusion Approach with One-Class Learning for Audio-Visual Deepfake Detection,https://arxiv.org/abs/2406.14176,2024-06-20,2024-06-25
Ranking LLMs by compression,https://arxiv.org/abs/2406.14171,2024-06-20,2024-06-25
Physics-informed neural networks for parameter learning of wildfire spreading,https://arxiv.org/abs/2406.14591,2024-06-20,2024-06-25
Optimizing Novelty of Top-k Recommendations using Large Language Models and Reinforcement Learning,https://arxiv.org/abs/2406.14169,2024-06-20,2024-06-25
Definition generation for lexical semantic change detection,https://arxiv.org/abs/2406.14167,2024-06-20,2024-06-25
DIRAS - Efficient LLM-Assisted Annotation of Document Relevance in Retrieval Augmented Generation,https://arxiv.org/abs/2406.14162,2024-06-20,2024-06-25
Enhancing multivariate post-processed visibility predictions utilizing CAMS forecasts,https://arxiv.org/abs/2406.14159,2024-06-20,2024-06-25
Tractable Equilibrium Computation in Markov Games through Risk Aversion,https://arxiv.org/abs/2406.14156,2024-06-20,2024-06-25
Aligning Large Language Models with Diverse Political Viewpoints,https://arxiv.org/abs/2406.14155,2024-06-20,2024-06-25
Watching the Watchers - A Comparative Fairness Audit of Cloud-based Content Moderation Services,https://arxiv.org/abs/2406.14154,2024-06-20,2024-06-25
Multi-modal Transfer Learning between Biological Foundation Models,https://arxiv.org/abs/2406.14150,2024-06-20,2024-06-25
Finding Safety Neurons in Large Language Models,https://arxiv.org/abs/2406.14144,2024-06-20,2024-06-25
Geometric Self-Supervised Pretraining on 3D Protein Structures using Subgraphs,https://arxiv.org/abs/2406.14142,2024-06-20,2024-06-25
Online Learning of Weakly Coupled MDP Policies for Load Balancing and Auto Scaling,https://arxiv.org/abs/2406.14141,2024-06-20,2024-06-25
MACAROON - Training Vision-Language Models To Be Your Engaged Partners,https://arxiv.org/abs/2406.14137,2024-06-20,2024-06-25
Autonomous Robotic Drilling System for Mice Cranial Window Creation,https://arxiv.org/abs/2406.14135,2024-06-20,2024-06-25
Enhancing Monotonic Modeling with Spatio-Temporal Adaptive Awareness in Diverse Marketing,https://arxiv.org/abs/2406.14132,2024-06-20,2024-06-25
Towards Event-oriented Long Video Understanding,https://arxiv.org/abs/2406.14129,2024-06-20,2024-06-25
Measuring Sample Importance in Data Pruning for Training LLMs from a Data Compression Perspective,https://arxiv.org/abs/2406.14124,2024-06-20,2024-06-25
EduQate - Generating Adaptive Curricula through RMABs in Education Settings,https://arxiv.org/abs/2406.14122,2024-06-20,2024-06-25
An Investigation of Prompt Variations for Zero-shot LLM-based Rankers,https://arxiv.org/abs/2406.14117,2024-06-20,2024-06-25
Take the essence and discard the dross - A Rethinking on Data Selection for Fine-Tuning Large Language Models,https://arxiv.org/abs/2406.14115,2024-06-20,2024-06-25
Expander Hierarchies for Normalized Cuts on Graphs,https://arxiv.org/abs/2406.14111,2024-06-20,2024-06-25
EasyECR - A Library for Easy Implementation and Evaluation of Event Coreference Resolution Models,https://arxiv.org/abs/2406.14106,2024-06-20,2024-06-25
Two-Stage Depth Enhanced Learning with Obstacle Map For Object Navigation,https://arxiv.org/abs/2406.14103,2024-06-20,2024-06-25
Let Guidelines Guide You - A Prescriptive Guideline-Centered Data Annotation Methodology,https://arxiv.org/abs/2406.14099,2024-06-20,2024-06-25
Enhancing the LLM-Based Robot Manipulation Through Human-Robot Collaboration,https://arxiv.org/abs/2406.14097,2024-06-20,2024-06-25
Graph Neural Networks for Job Shop Scheduling Problems - A Survey,https://arxiv.org/abs/2406.14096,2024-06-20,2024-06-25
Memory-Efficient Gradient Unrolling for Large-Scale Bi-level Optimization,https://arxiv.org/abs/2406.14095,2024-06-20,2024-06-25
Seamless Language Expansion - Enhancing Multilingual Mastery in Self-Supervised Models,https://arxiv.org/abs/2406.14092,2024-06-20,2024-06-25
Protecting Privacy Through Approximating Optimal Parameters for Sequence Unlearning in Language Models,https://arxiv.org/abs/2406.14091,2024-06-20,2024-06-25
Personalized Music Recommendation with a Heterogeneity-aware Deep Bayesian Network,https://arxiv.org/abs/2406.14090,2024-06-20,2024-06-25
ReaLHF - Optimized RLHF Training for Large Language Models through Parameter Reallocation,https://arxiv.org/abs/2406.14088,2024-06-20,2024-06-25
Semi Supervised Heterogeneous Domain Adaptation via Disentanglement and Pseudo-Labelling,https://arxiv.org/abs/2406.14087,2024-06-20,2024-06-25
Seg-LSTM - Performance of xLSTM for Semantic Segmentation of Remotely Sensed Images,https://arxiv.org/abs/2406.14086,2024-06-20,2024-06-25
Teaching Models To Survive - Proper Scoring Rule and Stochastic Optimization with Competing Risks,https://arxiv.org/abs/2406.14085,2024-06-20,2024-06-25
FLoCoRA - Federated learning compression with low-rank adaptation,https://arxiv.org/abs/2406.14082,2024-06-20,2024-06-25
EXCEEDS - Extracting Complex Events as Connecting the Dots to Graphs in Scientific Domain,https://arxiv.org/abs/2406.14075,2024-06-20,2024-06-25
Exploring Layerwise Adversarial Robustness Through the Lens of t-SNE,https://arxiv.org/abs/2406.14073,2024-06-20,2024-06-25
Bayesian Bandit Algorithms with Approximate Inference in Stochastic Linear Bandits,https://arxiv.org/abs/2406.14071,2024-06-20,2024-06-25
Optimizing Speculative Decoding for Serving Large Language Models Using Goodput,https://arxiv.org/abs/2406.14066,2024-06-20,2024-06-25
Tracking solutions of time-varying variational inequalities,https://arxiv.org/abs/2406.14059,2024-06-20,2024-06-25
How Many Parameters Does it Take to Change a Light Bulb? Evaluating Performance in Self-Play of Conversational Games as a Function of Model Characteristics,https://arxiv.org/abs/2406.14051,2024-06-20,2024-06-25
Prompt Injection Attacks in Defended Systems,https://arxiv.org/abs/2406.14048,2024-06-20,2024-06-25
Constrained Meta Agnostic Reinforcement Learning,https://arxiv.org/abs/2406.14047,2024-06-20,2024-06-25
Understanding Different Design Choices in Training Large Time Series Models,https://arxiv.org/abs/2406.14045,2024-06-20,2024-06-25
Encoder-Decoder Neural Networks in Interpretation of X-ray Spectra,https://arxiv.org/abs/2406.14044,2024-06-20,2024-06-25
Taxonomy-Guided Zero-Shot Recommendations with LLMs,https://arxiv.org/abs/2406.14043,2024-06-20,2024-06-25
A Practical Diffusion Path for Sampling,https://arxiv.org/abs/2406.14040,2024-06-20,2024-06-25
CryptoGPT - a 7B model rivaling GPT-4 in the task of analyzing and classifying real-time financial news,https://arxiv.org/abs/2406.14039,2024-06-20,2024-06-25
Toward Infinite-Long Prefix in Transformer,https://arxiv.org/abs/2406.14036,2024-06-20,2024-06-25
Two Giraffes in a Dirt Field - Using Game Play to Investigate Situation Modelling in Large Multimodal Models,https://arxiv.org/abs/2406.14035,2024-06-20,2024-06-25
Ensembles of Probabilistic Regression Trees,https://arxiv.org/abs/2406.14033,2024-06-20,2024-06-25
How to design a dataset compliant with an ML-based system ODD?,https://arxiv.org/abs/2406.14027,2024-06-20,2024-06-25
Demystifying Forgetting in Language Model Fine-Tuning with Statistical Analysis of Example Associations,https://arxiv.org/abs/2406.14026,2024-06-20,2024-06-25
The Reason behind Good or Bad - Towards a Better Mathematical Verifier with Natural Language Feedback,https://arxiv.org/abs/2406.14024,2024-06-20,2024-06-25
Evaluating Implicit Bias in Large Language Models by Attacking From a Psychometric Perspective,https://arxiv.org/abs/2406.14023,2024-06-20,2024-06-25
Investigating the Pre-Training Dynamics of In-Context Learning - Task Recognition vs. Task Learning,https://arxiv.org/abs/2406.14022,2024-06-20,2024-06-25
HIGHT - Hierarchical Graph Tokenization for Graph-Language Alignment,https://arxiv.org/abs/2406.14021,2024-06-20,2024-06-25
Leveraging eBPF and AI for Ransomware Nose Out,https://arxiv.org/abs/2406.14020,2024-06-20,2024-06-25
Confidence Intervals and Simultaneous Confidence Bands Based on Deep Learning,https://arxiv.org/abs/2406.14009,2024-06-20,2024-06-25
Do Not Wait - Learning Re-Ranking Model Without User Feedback At Serving Time in E-Commerce,https://arxiv.org/abs/2406.14004,2024-06-20,2024-06-25
Deep Optimal Experimental Design for Parameter Estimation Problems,https://arxiv.org/abs/2406.14003,2024-06-20,2024-06-25
"""Global is Good, Local is Bad?"" - Understanding Brand Bias in LLMs",https://arxiv.org/abs/2406.13997,2024-06-20,2024-06-25
Prediction of Unobserved Bifurcation by Unsupervised Extraction of Slowly Time-Varying System Parameter Dynamics from Time Series Using Reservoir Computing,https://arxiv.org/abs/2406.13995,2024-06-20,2024-06-25
Exploring Changes in Nation Perception with Nationality-Assigned Personas in LLMs,https://arxiv.org/abs/2406.13993,2024-06-20,2024-06-25
Robust Cooperative Multi-Agent Reinforcement Learning -A Mean-Field Type Game Perspective,https://arxiv.org/abs/2406.13992,2024-06-20,2024-06-25
Bayesian Inverse Reinforcement Learning for Non-Markovian Rewards,https://arxiv.org/abs/2406.13991,2024-06-20,2024-06-25
Inference-Time Decontamination - Reusing Leaked Benchmarks for Large Language Model Evaluation,https://arxiv.org/abs/2406.13990,2024-06-20,2024-06-25
Random pairing MLE for estimation of item parameters in Rasch model,https://arxiv.org/abs/2406.13989,2024-06-20,2024-06-25
Image anomaly detection and prediction scheme based on SSA optimized ResNet50-BiGRU model,https://arxiv.org/abs/2406.13987,2024-06-20,2024-06-25
"The Elusive Pursuit of Replicating PATE-GAN - Benchmarking, Auditing, Debugging",https://arxiv.org/abs/2406.13985,2024-06-20,2024-06-25
Reducing Memory Contention and I/O Congestion for Disk-based GNN Training,https://arxiv.org/abs/2406.13984,2024-06-20,2024-06-25
MR-BEN - A Comprehensive Meta-Reasoning Benchmark for Large Language Models,https://arxiv.org/abs/2406.13975,2024-06-20,2024-06-25
Machine Learning Techniques in Automatic Music Transcription - A Systematic Survey,https://arxiv.org/abs/2406.15249,2024-06-20,2024-06-25
Complex fractal trainability boundary can arise from trivial non-convexity,https://arxiv.org/abs/2406.13971,2024-06-20,2024-06-25
Recent Advances in Traffic Accident Analysis and Prediction - A Comprehensive Review of Machine Learning Techniques,https://arxiv.org/abs/2406.13968,2024-06-20,2024-06-25
DataComp-LM - In search of the next generation of training sets for language models,https://arxiv.org/abs/2406.11794,2024-06-17,2024-06-25
Understanding and Mitigating Tokenization Bias in Language Models,https://arxiv.org/abs/2406.16829,2024-06-24,2024-06-25
Lottery Ticket Adaptation - Mitigating Destructive Interference in LLMs,https://arxiv.org/abs/2406.16797,2024-06-24,2024-06-25
Adam-mini - Use Fewer Learning Rates To Gain More,https://arxiv.org/abs/2406.16793,2024-06-24,2024-06-25
Finding Transformer Circuits with Edge Pruning,https://arxiv.org/abs/2406.16778,2024-06-24,2024-06-25
The Responsible Foundation Model Development Cheatsheet - A Review of Tools & Resources,https://arxiv.org/abs/2406.16746,2024-06-24,2024-06-25
Scaling Laws for Linear Complexity Language Models,https://arxiv.org/abs/2406.16690,2024-06-24,2024-06-25
Forecasting with Deep Learning - Beyond Average of Average of Average Performance,https://arxiv.org/abs/2406.16590,2024-06-24,2024-06-25
LLaMA-MoE - Building Mixture-of-Experts from LLaMA with Continual Pre-training,https://arxiv.org/abs/2406.16554,2024-06-24,2024-06-25
Large Vocabulary Size Improves Large Language Models,https://arxiv.org/abs/2406.16508,2024-06-24,2024-06-25
OTCE - Hybrid SSM and Attention with Cross Domain Mixture of Experts to construct Observer-Thinker-Conceiver-Expresser,https://arxiv.org/abs/2406.16495,2024-06-24,2024-06-25
The Hidden Pitfalls of the Cosine Similarity Loss,https://arxiv.org/abs/2406.16468,2024-06-24,2024-06-25
Building on Efficient Foundations - Effectively Training LLMs with Structured Feedforward Layers,https://arxiv.org/abs/2406.16450,2024-06-24,2024-06-25
Theory on Mixture-of-Experts in Continual Learning,https://arxiv.org/abs/2406.16437,2024-06-24,2024-06-25
Pruning via Merging - Compressing LLMs via Manifold Alignment Based Layer Merging,https://arxiv.org/abs/2406.16330,2024-06-24,2024-06-25
What Do VLMs NOTICE - A Mechanistic Interpretability Pipeline for Noise-free Text-Image Corruption and Evaluation,https://arxiv.org/abs/2406.16320,2024-06-24,2024-06-25
Does Cross-Cultural Alignment Change the Commonsense Morality of Language Models -,https://arxiv.org/abs/2406.16316,2024-06-24,2024-06-25
One Thousand and One Pairs - A  -novel - challenge for long-context language models,https://arxiv.org/abs/2406.16264,2024-06-24,2024-06-25
Video-Infinity - Distributed Long Video Generation,https://arxiv.org/abs/2406.16260,2024-06-24,2024-06-25
LLMs' Classification Performance is Overclaimed,https://arxiv.org/abs/2406.16203,2024-06-23,2024-06-25
FastMem - Fast Memorization of Prompt Improves Context Awareness of Large Language Models,https://arxiv.org/abs/2406.16069,2024-06-23,2024-06-25
Combine and Conquer - A Meta-Analysis on Data Shift and Out-of-Distribution Detection,https://arxiv.org/abs/2406.16045,2024-06-23,2024-06-25
Unlocking the Future - Exploring Look-Ahead Planning Mechanistic Interpretability in Large Language Models,https://arxiv.org/abs/2406.16033,2024-06-23,2024-06-25
Effect of Random Learning Rate - Theoretical Analysis of SGD Dynamics in Non-Convex Optimization via Stationary Distribution,https://arxiv.org/abs/2406.16032,2024-06-23,2024-06-25
Distributed Rule Vectors is A Key Mechanism in Large Language Models' In-Context Learning,https://arxiv.org/abs/2406.16007,2024-06-23,2024-06-25
SimSMoE - Solving Representational Collapse via Similarity Measure,https://arxiv.org/abs/2406.15883,2024-06-22,2024-06-25
What Matters in Transformers - Not All Attention is Needed,https://arxiv.org/abs/2406.15786,2024-06-22,2024-06-25
Unveiling and Harnessing Hidden Attention Sinks - Enhancing Large Language Models without Training through Attention Calibration,https://arxiv.org/abs/2406.15765,2024-06-22,2024-06-25
Scaling Laws for Fact Memorization of Large Language Models,https://arxiv.org/abs/2406.15720,2024-06-22,2024-06-25
Large Language Models have Intrinsic Self-Correction Ability,https://arxiv.org/abs/2406.15673,2024-06-21,2024-06-25
Hybrid Alignment Training for Large Language Models,https://arxiv.org/abs/2406.15178,2024-06-21,2024-06-25
Brain-Like Language Processing via a Shallow Untrained Multihead Attention Network,https://arxiv.org/abs/2406.15109,2024-06-21,2024-06-25
HLQ - Fast and Efficient Backpropagation via Hadamard Low-rank Quantization,https://arxiv.org/abs/2406.15102,2024-06-21,2024-06-25
Optimised Grouped-Query Attention Mechanism for Transformers,https://arxiv.org/abs/2406.14963,2024-06-21,2024-06-25
MoA - Mixture of Sparse Attention for Automatic Large Language Model Compression,https://arxiv.org/abs/2406.14909,2024-06-21,2024-06-25
Do LLMs Have Distinct and Consistent Personality - TRAIT - Personality Testset designed for LLMs with Psychometrics,https://arxiv.org/abs/2406.14703,2024-06-20,2024-06-25
Can LLMs Learn by Teaching - A Preliminary Study,https://arxiv.org/abs/2406.14629,2024-06-20,2024-06-25
DataComp-LM - In search of the next generation of training sets for language models,https://arxiv.org/abs/2406.11794,2024-06-17,2024-06-25
EXTRACT - Efficient Policy Learning by Extracting Transferrable Robot Skills from Offline Data,https://arxiv.org/abs/2406.17768,2024-06-25,2024-06-26
BMIKE-53 - Investigating Cross-Lingual Knowledge Editing with In-Context Learning,https://arxiv.org/abs/2406.17764,2024-06-25,2024-06-26
DiffusionPDE - Generative PDE-Solving Under Partial Observation,https://arxiv.org/abs/2406.17763,2024-06-25,2024-06-26
Solving Hard Mizar Problems with Instantiation and Strategy Invention,https://arxiv.org/abs/2406.17762,2024-06-25,2024-06-26
CaLMQA - Exploring culturally specific long-form question answering across 23 languages,https://arxiv.org/abs/2406.17761,2024-06-25,2024-06-26
Interpreting Attention Layer Outputs with Sparse Autoencoders,https://arxiv.org/abs/2406.17759,2024-06-25,2024-06-26
Measuring and Benchmarking Large Language Models' Capabilities to Generate Persuasive Language,https://arxiv.org/abs/2406.17753,2024-06-25,2024-06-26
Benchmarking Deep Learning Models on NVIDIA Jetson Nano for Real-Time Systems - An Empirical Investigation,https://arxiv.org/abs/2406.17749,2024-06-25,2024-06-26
A New Perspective on Shampoo's Preconditioner,https://arxiv.org/abs/2406.17748,2024-06-25,2024-06-26
Probing the effects of broken symmetries in machine learning,https://arxiv.org/abs/2406.17747,2024-06-25,2024-06-26
"Recite, Reconstruct, Recollect - Memorization in LMs as a Multifaceted Phenomenon",https://arxiv.org/abs/2406.17746,2024-06-25,2024-06-26
Light-weight End-to-End Graph Interest Network for CTR Prediction in E-commerce Search,https://arxiv.org/abs/2406.17745,2024-06-25,2024-06-26
Following Length Constraints in Instructions,https://arxiv.org/abs/2406.17744,2024-06-25,2024-06-26
Point-SAM - Promptable 3D Segmentation Model for Point Clouds,https://arxiv.org/abs/2406.17741,2024-06-25,2024-06-26
Structured Unrestricted-Rank Matrices for Parameter Efficient Fine-tuning,https://arxiv.org/abs/2406.17740,2024-06-25,2024-06-26
Find Parent then Label Children - A Two-stage Taxonomy Completion Method with Pre-trained Language Model,https://arxiv.org/abs/2406.17739,2024-06-25,2024-06-26
LLM Targeted Underperformance Disproportionately Impacts Vulnerable Users,https://arxiv.org/abs/2406.17737,2024-06-25,2024-06-26
Fairness in Social Influence Maximization via Optimal Transport,https://arxiv.org/abs/2406.17736,2024-06-25,2024-06-26
When does Self-Prediction help? Understanding Auxiliary Tasks in Reinforcement Learning,https://arxiv.org/abs/2406.17718,2024-06-25,2024-06-26
ViANLI - Adversarial Natural Language Inference for Vietnamese,https://arxiv.org/abs/2406.17716,2024-06-25,2024-06-26
Compositional Models for Estimating Causal Effects,https://arxiv.org/abs/2406.17714,2024-06-25,2024-06-26
Data curation via joint example selection further accelerates multimodal learning,https://arxiv.org/abs/2406.17711,2024-06-25,2024-06-26
FedBiOT - LLM Local Fine-tuning in Federated Learning without Full Model,https://arxiv.org/abs/2406.17706,2024-06-25,2024-06-26
Can independent Metropolis beat crude Monte Carlo?,https://arxiv.org/abs/2406.17699,2024-06-25,2024-06-26
Identifying Nonstationary Causal Structures with High-Order Markov Switching Models,https://arxiv.org/abs/2406.17698,2024-06-25,2024-06-26
HGTDP-DTA - Hybrid Graph-Transformer with Dynamic Prompt for Drug-Target Binding Affinity Prediction,https://arxiv.org/abs/2406.17697,2024-06-25,2024-06-26
From Distributional to Overton Pluralism - Investigating Large Language Model Alignment,https://arxiv.org/abs/2406.17692,2024-06-25,2024-06-26
Unified Auto-Encoding with Masked Diffusion,https://arxiv.org/abs/2406.17688,2024-06-25,2024-06-26
VarBench - Robust Language Model Benchmarking Through Dynamic Variable Perturbation,https://arxiv.org/abs/2406.17681,2024-06-25,2024-06-26
Quantifying AI Psychology - A Psychometrics Benchmark for Large Language Models,https://arxiv.org/abs/2406.17675,2024-06-25,2024-06-26
This Paper Had the Smartest Reviewers -- Flattery Detection Utilising an Audio-Textual Transformer-Based Approach,https://arxiv.org/abs/2406.17667,2024-06-25,2024-06-26
LLM-ARC - Enhancing LLMs with an Automated Reasoning Critic,https://arxiv.org/abs/2406.17663,2024-06-25,2024-06-26
Grass - Compute Efficient Low-Memory LLM Training with Structured Sparse Gradients,https://arxiv.org/abs/2406.17660,2024-06-25,2024-06-26
DKPROMPT - Domain Knowledge Prompting Vision-Language Models for Open-World Planning,https://arxiv.org/abs/2406.17659,2024-06-25,2024-06-26
MDHA - Multi-Scale Deformable Transformer with Hybrid Anchors for Multi-View 3D Object Detection,https://arxiv.org/abs/2406.17654,2024-06-25,2024-06-26
Leveraging Large Language Models for Software Model Completion - Results from Industrial and Public Datasets,https://arxiv.org/abs/2406.17651,2024-06-25,2024-06-26
ELIZA Reinterpreted - The world's first chatbot was not intended as a chatbot at all,https://arxiv.org/abs/2406.17650,2024-06-25,2024-06-26
Privacy Preserving Reinforcement Learning for Population Processes,https://arxiv.org/abs/2406.17649,2024-06-25,2024-06-26
Variationist - Exploring Multifaceted Variation and Bias in Written Language Data,https://arxiv.org/abs/2406.17647,2024-06-25,2024-06-26
Banishing LLM Hallucinations Requires Rethinking Generalization,https://arxiv.org/abs/2406.17642,2024-06-25,2024-06-26
Mitigate the Gap - Investigating Approaches for Improving Cross-Modal Alignment in CLIP,https://arxiv.org/abs/2406.17639,2024-06-25,2024-06-26
Aligning Diffusion Models with Noise-Conditioned Perception,https://arxiv.org/abs/2406.17636,2024-06-25,2024-06-26
Knowledge Distillation in Automated Annotation - Supervised Text Classification with LLM-Generated Training Labels,https://arxiv.org/abs/2406.17633,2024-06-25,2024-06-26
CoSafe - Evaluating Large Language Model Safety in Multi-Turn Dialogue Coreference,https://arxiv.org/abs/2406.17626,2024-06-25,2024-06-26
"Self-assessment, Exhibition, and Recognition - a Review of Personality in Large Language Models",https://arxiv.org/abs/2406.17624,2024-06-25,2024-06-26
Towards Building an End-to-End Multilingual Automatic Lyrics Transcription Model,https://arxiv.org/abs/2406.17618,2024-06-25,2024-06-26
Aligning Programming Language and Natural Language - Exploring Design Choices in Multi-Modal Transformer-Based Embedding for Bug Localization,https://arxiv.org/abs/2406.17615,2024-06-25,2024-06-26
Distributed Training of Large Graph Neural Networks with Variable Communication Rates,https://arxiv.org/abs/2406.17611,2024-06-25,2024-06-26
Diffusion-based Adversarial Purification for Intrusion Detection,https://arxiv.org/abs/2406.17606,2024-06-25,2024-06-26
"""Seeing the Big through the Small"" - Can LLMs Approximate Human Judgment Distributions on NLI from a Few Explanations?",https://arxiv.org/abs/2406.17600,2024-06-25,2024-06-26
Constructing structured tensor priors for Bayesian inverse problems,https://arxiv.org/abs/2406.17597,2024-06-25,2024-06-26
LongIns - A Challenging Long-context Instruction-based Exam for LLMs,https://arxiv.org/abs/2406.17588,2024-06-25,2024-06-26
"Learning Dynamic Bayesian Networks from Data - Foundations, First Principles and Numerical Comparisons",https://arxiv.org/abs/2406.17585,2024-06-25,2024-06-26
Leveraging Reinforcement Learning in Red Teaming for Advanced Ransomware Attack Simulations,https://arxiv.org/abs/2406.17576,2024-06-25,2024-06-26
Causal Responder Detection,https://arxiv.org/abs/2406.17571,2024-06-25,2024-06-26
FrenchToxicityPrompts - a Large Benchmark for Evaluating and Mitigating Toxicity in French Texts,https://arxiv.org/abs/2406.17566,2024-06-25,2024-06-26
Multi-property Steering of Large Language Models with Dynamic Activation Composition,https://arxiv.org/abs/2406.17563,2024-06-25,2024-06-26
The FineWeb Datasets - Decanting the Web for the Finest Text Data at Scale,https://arxiv.org/abs/2406.17557,2024-06-25,2024-06-26
Modularity Based Community Detection in Hypergraphs,https://arxiv.org/abs/2406.17556,2024-06-25,2024-06-26
Retrieval-Augmented Code Generation for Situated Action Generation - A Case Study on Minecraft,https://arxiv.org/abs/2406.17553,2024-06-25,2024-06-26
CDQuant - Accurate Post-training Weight Quantization of Large Pre-trained Models using Greedy Coordinate Descent,https://arxiv.org/abs/2406.17542,2024-06-25,2024-06-26
