Title,ArXiv Link,Paper Date,Date Added
"Show Less, Instruct More - Enriching Prompts with Definitions and Guidelines for Zero-Shot NER",https://arxiv.org/abs/2407.01272,2024-07-01,2024-07-03
SignCLIP - Connecting Text and Sign Language by Contrastive Learning,https://arxiv.org/abs/2407.01264,2024-07-01,2024-07-03
Complementary Fusion of Deep Network and Tree Model for ETA Prediction,https://arxiv.org/abs/2407.01262,2024-07-01,2024-07-03
Introducing a Physics-informed Deep Learning Framework for Bridge Scour Prediction,https://arxiv.org/abs/2407.01258,2024-07-01,2024-07-03
uDistil-Whisper - Label-Free Data Filtering for Knowledge Distillation via Large-Scale Pseudo Labelling,https://arxiv.org/abs/2407.01257,2024-07-01,2024-07-03
Metric-Entropy Limits on Nonlinear Dynamical System Learning,https://arxiv.org/abs/2407.01250,2024-07-01,2024-07-03
The Solution for Temporal Sound Localisation Task of ICCV 1st Perception Test Challenge 2023,https://arxiv.org/abs/2407.02318,2024-07-01,2024-07-03
A Deep Reinforcement Learning Approach to Battery Management in Dairy Farming via Proximal Policy Optimization,https://arxiv.org/abs/2407.01653,2024-07-01,2024-07-03
SINKT - A Structure-Aware Inductive Knowledge Tracing Model with Large Language Model,https://arxiv.org/abs/2407.01245,2024-07-01,2024-07-03
SGCCNet - Single-Stage 3D Object Detector With Saliency-Guided Data Augmentation and Confidence Correction Mechanism,https://arxiv.org/abs/2407.01239,2024-07-01,2024-07-03
Large Language Models are Zero-Shot Recognizers for Activities of Daily Living,https://arxiv.org/abs/2407.01238,2024-07-01,2024-07-03
MIRAI - Evaluating LLM Agents for Event Forecasting,https://arxiv.org/abs/2407.01231,2024-07-01,2024-07-03
Bayesian grey-box identification of nonlinear convection effects in heat transfer dynamics,https://arxiv.org/abs/2407.01226,2024-07-01,2024-07-03
Searching for Best Practices in Retrieval-Augmented Generation,https://arxiv.org/abs/2407.01219,2024-07-01,2024-07-03
Let Hybrid A* Path Planner Obey Traffic Rules - A Deep Reinforcement Learning-Based Planning Framework,https://arxiv.org/abs/2407.01216,2024-07-01,2024-07-03
Revisiting Random Walks for Learning on Graphs,https://arxiv.org/abs/2407.01214,2024-07-01,2024-07-03
EconNLI - Evaluating Large Language Models on Economics Reasoning,https://arxiv.org/abs/2407.01212,2024-07-01,2024-07-03
Efficient Cutting Tool Wear Segmentation Based on Segment Anything Model,https://arxiv.org/abs/2407.01211,2024-07-01,2024-07-03
Deep Learning Approach for Enhanced Transferability and Learning Capacity in Tool Wear Estimation,https://arxiv.org/abs/2407.01200,2024-07-01,2024-07-03
Deep Learning Based Tool Wear Estimation Considering Cutting Conditions,https://arxiv.org/abs/2407.01199,2024-07-01,2024-07-03
A Learned Generalized Geodesic Distance Function-Based Approach for Node Feature Augmentation on Graphs,https://arxiv.org/abs/2407.01194,2024-07-01,2024-07-03
MARS - Multimodal Active Robotic Sensing for Articulated Characterization,https://arxiv.org/abs/2407.01191,2024-07-01,2024-07-03
$\text{Memory}^3$ - Language Modeling with Explicit Memory,https://arxiv.org/abs/2407.01178,2024-07-01,2024-07-03
Neural Conditional Probability for Inference,https://arxiv.org/abs/2407.01171,2024-07-01,2024-07-03
Multi-View Black-Box Physical Attacks on Infrared Pedestrian Detectors Using Adversarial Infrared Grid,https://arxiv.org/abs/2407.01168,2024-07-01,2024-07-03
Benchmarking Predictive Coding Networks -- Made Simple,https://arxiv.org/abs/2407.01163,2024-07-01,2024-07-03
Learning to Explore and Select for Coverage-Conditioned Retrieval-Augmented Generation,https://arxiv.org/abs/2407.01158,2024-07-01,2024-07-03
Unaligning Everything - Or Aligning Any Text to Any Image in Multimodal Models,https://arxiv.org/abs/2407.01157,2024-07-01,2024-07-03
CPT - Consistent Proxy Tuning for Black-box Optimization,https://arxiv.org/abs/2407.01155,2024-07-01,2024-07-03
Sociocultural Considerations in Monitoring Anti-LGBTQ+ Content on Social Media,https://arxiv.org/abs/2407.01149,2024-07-01,2024-07-03
Are you sure? Analysing Uncertainty Quantification Approaches for Real-world Speech Emotion Recognition,https://arxiv.org/abs/2407.01143,2024-07-01,2024-07-03
An Empirical Comparison of Generative Approaches for Product Attribute-Value Identification,https://arxiv.org/abs/2407.01137,2024-07-01,2024-07-03
Cross-Lingual Transfer Learning for Speech Translation,https://arxiv.org/abs/2407.01130,2024-07-01,2024-07-03
Investigating the potential of Sparse Mixtures-of-Experts for multi-domain neural machine translation,https://arxiv.org/abs/2407.01126,2024-07-01,2024-07-03
Calibrated Large Language Models for Binary Question Answering,https://arxiv.org/abs/2407.01122,2024-07-01,2024-07-03
Pron vs Prompt - Can Large Language Models already Challenge a World-Class Fiction Author at Creative Text Writing?,https://arxiv.org/abs/2407.01119,2024-07-01,2024-07-03
"Enabling Mixed Effects Neural Networks for Diverse, Clustered Data Using Monte Carlo Methods",https://arxiv.org/abs/2407.01115,2024-07-01,2024-07-03
Proximity Matters - Local Proximity Preserved Balancing for Treatment Effect Estimation,https://arxiv.org/abs/2407.01111,2024-07-01,2024-07-03
SecGenAI - Enhancing Security of Cloud-based Generative AI Applications within Australian Critical Technologies of National Interest,https://arxiv.org/abs/2407.01110,2024-07-01,2024-07-03
BERGEN - A Benchmarking Library for Retrieval-Augmented Generation,https://arxiv.org/abs/2407.01102,2024-07-01,2024-07-03
Eliminating Position Bias of Language Models - A Mechanistic Approach,https://arxiv.org/abs/2407.01100,2024-07-01,2024-07-03
IBSEN - Director-Actor Agent Collaboration for Controllable and Interactive Drama Script Generation,https://arxiv.org/abs/2407.01093,2024-07-01,2024-07-03
Kolmogorov-Arnold Convolutions - Design Principles and Empirical Studies,https://arxiv.org/abs/2407.01092,2024-07-01,2024-07-03
M2QA - Multi-domain Multilingual Question Answering,https://arxiv.org/abs/2407.01091,2024-07-01,2024-07-03
Rethinking LLM-based Preference Evaluation,https://arxiv.org/abs/2407.01085,2024-07-01,2024-07-03
Min P Sampling - Balancing Creativity and Coherence at High Temperature,https://arxiv.org/abs/2407.01082,2024-07-01,2024-07-03
CVLUE - A New Benchmark Dataset for Chinese Vision-Language Understanding Evaluation,https://arxiv.org/abs/2407.01081,2024-07-01,2024-07-03
Face4RAG - Factual Consistency Evaluation for Retrieval Augmented Generation in Chinese,https://arxiv.org/abs/2407.01080,2024-07-01,2024-07-03
On Statistical Rates and Provably Efficient Criteria of Latent Diffusion Transformers (DiTs),https://arxiv.org/abs/2407.01079,2024-07-01,2024-07-03
Human-like object concept representations emerge naturally in multimodal large language models,https://arxiv.org/abs/2407.01067,2024-07-01,2024-07-03
Improve ROI with Causal Learning and Conformal Prediction,https://arxiv.org/abs/2407.01065,2024-07-01,2024-07-03
Joint Pruning and Channel-wise Mixed-Precision Quantization for Efficient Deep Neural Networks,https://arxiv.org/abs/2407.01054,2024-07-01,2024-07-03
"Evolutionary Morphology Towards Overconstrained Locomotion via Large-Scale, Multi-Terrain Deep Reinforcement Learning",https://arxiv.org/abs/2407.01050,2024-07-01,2024-07-03
SE(3)-Hyena Operator for Scalable Equivariant Learning,https://arxiv.org/abs/2407.01049,2024-07-01,2024-07-03
Development of Cognitive Intelligence in Pre-trained Language Models,https://arxiv.org/abs/2407.01047,2024-07-01,2024-07-03
FRoG - Evaluating Fuzzy Reasoning of Generalized Quantifiers in Large Language Models,https://arxiv.org/abs/2407.01046,2024-07-01,2024-07-03
Ranking by Lifts - A Cost-Benefit Approach to Large-Scale A/B Tests,https://arxiv.org/abs/2407.01036,2024-07-01,2024-07-03
Neural Networks Trained by Weight Permutation are Universal Approximators,https://arxiv.org/abs/2407.01033,2024-07-01,2024-07-03
Overcoming Common Flaws in the Evaluation of Selective Classification Systems,https://arxiv.org/abs/2407.01032,2024-07-01,2024-07-03
PocketLLM - Enabling On-Device Fine-Tuning for Personalized LLMs,https://arxiv.org/abs/2407.01031,2024-07-01,2024-07-03
Augmenting Document-level Relation Extraction with Efficient Multi-Supervision,https://arxiv.org/abs/2407.01026,2024-07-01,2024-07-03
DistML.js - Installation-free Distributed Deep Learning Framework for Web Browsers,https://arxiv.org/abs/2407.01023,2024-07-01,2024-07-03
Bayesian Entropy Neural Networks for Physics-Aware Prediction,https://arxiv.org/abs/2407.01015,2024-07-01,2024-07-03
Swish-T  - Enhancing Swish Activation with Tanh Bias for Improved Neural Network Performance,https://arxiv.org/abs/2407.01012,2024-07-01,2024-07-03
DynaThink - Fast or Slow? A Dynamic Decision-Making Framework for Large Language Models,https://arxiv.org/abs/2407.01009,2024-07-01,2024-07-03
"Engineering Conversational Search Systems - A Review of Applications, Architectures, and Functional Components",https://arxiv.org/abs/2407.00997,2024-07-01,2024-07-03
"Can Small Language Models Learn, Unlearn, and Retain Noise Patterns?",https://arxiv.org/abs/2407.00996,2024-07-01,2024-07-03
LLM Uncertainty Quantification through Directional Entailment Graph and Claim Level Response Augmentation,https://arxiv.org/abs/2407.00994,2024-07-01,2024-07-03
Aligning Target-Aware Molecule Diffusion Models with Exact Energy Optimization,https://arxiv.org/abs/2407.01648,2024-07-01,2024-07-03
Mobile-Bench - An Evaluation Benchmark for LLM-based Mobile Agents,https://arxiv.org/abs/2407.00993,2024-07-01,2024-07-03
VisEval - A Benchmark for Data Visualization in the Era of Large Language Models,https://arxiv.org/abs/2407.00981,2024-07-01,2024-07-03
Optimizing PM2.5 Forecasting Accuracy with Hybrid Meta-Heuristic and Machine Learning Models,https://arxiv.org/abs/2407.01647,2024-07-01,2024-07-03
How Does Overparameterization Affect Features?,https://arxiv.org/abs/2407.00968,2024-07-01,2024-07-03
Smoothed Analysis for Learning Concepts with Low Intrinsic Dimension,https://arxiv.org/abs/2407.00966,2024-07-01,2024-07-03
Universal Approximation Theory - The basic theory for large language models,https://arxiv.org/abs/2407.00958,2024-07-01,2024-07-03
Expressivity of Neural Networks with Random Weights and Learned Biases,https://arxiv.org/abs/2407.00957,2024-07-01,2024-07-03
A Closer Look at Deep Learning on Tabular Data,https://arxiv.org/abs/2407.00956,2024-07-01,2024-07-03
Task-oriented Over-the-air Computation for Edge-device Co-inference with Balanced Classification Accuracy,https://arxiv.org/abs/2407.00955,2024-07-01,2024-07-03
SplitLoRA - A Split Parameter-Efficient Fine-Tuning Framework for Large Language Models,https://arxiv.org/abs/2407.00952,2024-07-01,2024-07-03
"Causal Bandits - The Pareto Optimal Frontier of Adaptivity, a Reduction to Linear Bandits, and Limitations around Unknown Marginals",https://arxiv.org/abs/2407.00950,2024-07-01,2024-07-03
The House Always Wins - A Framework for Evaluating Strategic Deception in LLMs,https://arxiv.org/abs/2407.00948,2024-07-01,2024-07-03
Efficient Expert Pruning for Sparse Mixture-of-Experts Language Models - Enhancing Performance and Reducing Inference Costs,https://arxiv.org/abs/2407.00945,2024-07-01,2024-07-03
ProductAgent - Benchmarking Conversational Product Search Agent with Asking Clarification Questions,https://arxiv.org/abs/2407.00942,2024-07-01,2024-07-03
MalAlgoQA - A Pedagogical Approach for Evaluating Counterfactual Reasoning Abilities,https://arxiv.org/abs/2407.00938,2024-07-01,2024-07-03
Large Language Model Enhanced Knowledge Representation Learning - A Survey,https://arxiv.org/abs/2407.00936,2024-07-01,2024-07-03
Look Ahead or Look Around? A Theoretical Comparison Between Autoregressive and Masked Pretraining,https://arxiv.org/abs/2407.00935,2024-07-01,2024-07-03
CLEME2.0 - Towards More Interpretable Evaluation by Disentangling Edits for Grammatical Error Correction,https://arxiv.org/abs/2407.00934,2024-07-01,2024-07-03
FoldGPT - Simple and Effective Large Language Model Compression Scheme,https://arxiv.org/abs/2407.00928,2024-07-01,2024-07-03
Learnability of Parameter-Bounded Bayes Nets,https://arxiv.org/abs/2407.00927,2024-07-01,2024-07-03
ESALE - Enhancing Code-Summary Alignment Learning for Source Code Summarization,https://arxiv.org/abs/2407.01646,2024-07-01,2024-07-03
EXCGEC - A Benchmark of Edit-wise Explainable Chinese Grammatical Error Correction,https://arxiv.org/abs/2407.00924,2024-07-01,2024-07-03
Preserving Multilingual Quality While Tuning Query Encoder on English Only,https://arxiv.org/abs/2407.00923,2024-07-01,2024-07-03
Robust and Reliable Early-Stage Website Fingerprinting Attacks via Spatial-Temporal Distribution Analysis,https://arxiv.org/abs/2407.00918,2024-07-01,2024-07-03
Learnability in Online Kernel Selection with Memory Constraint via Data-dependent Regret Analysis,https://arxiv.org/abs/2407.00916,2024-07-01,2024-07-03
SecureSpectra - Safeguarding Digital Identity from Deep Fake Threats via Intelligent Signatures,https://arxiv.org/abs/2407.00913,2024-07-01,2024-07-03
Deep Image-to-Recipe Translation,https://arxiv.org/abs/2407.00911,2024-07-01,2024-07-03
FineSurE - Fine-grained Summarization Evaluation using LLMs,https://arxiv.org/abs/2407.00908,2024-07-01,2024-07-03
GSO-YOLO - Global Stability Optimization YOLO for Construction Site Detection,https://arxiv.org/abs/2407.00906,2024-07-01,2024-07-03
Sign Gradient Descent-based Neuronal Dynamics - ANN-to-SNN Conversion Beyond ReLU Network,https://arxiv.org/abs/2407.01645,2024-07-01,2024-07-03
From Introspection to Best Practices - Principled Analysis of Demonstrations in Multimodal In-Context Learning,https://arxiv.org/abs/2407.00902,2024-07-01,2024-07-03
MathCAMPS - Fine-grained Synthesis of Mathematical Problems From Human Curricula,https://arxiv.org/abs/2407.00900,2024-07-01,2024-07-03
"Channel Modeling Aided Dataset Generation for AI-Enabled CSI Feedback - Advances, Challenges, and Solutions",https://arxiv.org/abs/2407.00896,2024-07-01,2024-07-03
How to Leverage Digit Embeddings to Represent Numbers?,https://arxiv.org/abs/2407.00894,2024-07-01,2024-07-03
ZeroDDI - A Zero-Shot Drug-Drug Interaction Event Prediction Method with Semantic Enhanced Learning and Dual-Modal Uniform Alignment,https://arxiv.org/abs/2407.00891,2024-07-01,2024-07-03
Macroeconomic Forecasting with Large Language Models,https://arxiv.org/abs/2407.00890,2024-07-01,2024-07-03
Mechanistic Interpretation through Contextual Decomposition in Transformers,https://arxiv.org/abs/2407.00886,2024-07-01,2024-07-03
Roleplay-doh - Enabling Domain-Experts to Create LLM-simulated Patients via Eliciting and Adhering to Principles,https://arxiv.org/abs/2407.00870,2024-07-01,2024-07-03
Large Language Models Are Involuntary Truth-Tellers - Exploiting Fallacy Failure for Jailbreak Attacks,https://arxiv.org/abs/2407.00869,2024-07-01,2024-07-03
Silver Linings in the Shadows - Harnessing Membership Inference for Machine Unlearning,https://arxiv.org/abs/2407.00866,2024-07-01,2024-07-03
Evaluating the Role of Data Enrichment Approaches Towards Rare Event Analysis in Manufacturing,https://arxiv.org/abs/2407.01644,2024-07-01,2024-07-03
A Deep Generative Framework for Joint Households and Individuals Population Synthesis,https://arxiv.org/abs/2407.01643,2024-06-30,2024-07-03
Towards Understanding Sensitive and Decisive Patterns in Explainable AI - A Case Study of Model Interpretation in Geometric Deep Learning,https://arxiv.org/abs/2407.00849,2024-06-30,2024-07-03
A Unified Approach to Extract Intepretable Rules from Tree Ensembles via Integer Programming,https://arxiv.org/abs/2407.00843,2024-06-30,2024-07-03
MUSE-Net - Missingness-aware mUlti-branching Self-attention Encoder for Irregular Longitudinal Electronic Health Records,https://arxiv.org/abs/2407.00840,2024-06-30,2024-07-03
NeurIPS 2024 ML4CFD Competition - Harnessing Machine Learning for Computational Fluid Dynamics in Airfoil Design,https://arxiv.org/abs/2407.01641,2024-06-30,2024-07-03
Towards Robust Speech Representation Learning for Thousands of Languages,https://arxiv.org/abs/2407.00837,2024-06-30,2024-07-03
BADM - Batch ADMM for Deep Learning,https://arxiv.org/abs/2407.01640,2024-06-30,2024-07-03
NAIST Simultaneous Speech Translation System for IWSLT 2024,https://arxiv.org/abs/2407.00826,2024-06-30,2024-07-03
ModelVerification.jl - a Comprehensive Toolbox for Formally Verifying Deep Neural Networks,https://arxiv.org/abs/2407.01639,2024-06-30,2024-07-03
LASSI - An LLM-based Automated Self-Correcting Pipeline for Translating Parallel Scientific Codes,https://arxiv.org/abs/2407.01638,2024-06-30,2024-07-03
"Kernel Neural Operators (KNOs) for Scalable, Memory-efficient, Geometrically-flexible Operator Learning",https://arxiv.org/abs/2407.00809,2024-06-30,2024-07-03
Exploring a Physics-Informed Decision Transformer for Distribution System Restoration - Methodology and Performance Analysis,https://arxiv.org/abs/2407.00808,2024-06-30,2024-07-03
Towards shutdownable agents via stochastic choice,https://arxiv.org/abs/2407.00805,2024-06-30,2024-07-03
Model-Free Active Exploration in Reinforcement Learning,https://arxiv.org/abs/2407.00801,2024-06-30,2024-07-03
Enhancing Travel Decision-Making - A Contrastive Learning Approach for Personalized Review Rankings in Accommodations,https://arxiv.org/abs/2407.00787,2024-06-30,2024-07-03
Diffusion Models and Representation Learning - A Survey,https://arxiv.org/abs/2407.00783,2024-06-30,2024-07-03
Step-Controlled DPO - Leveraging Stepwise Error for Enhanced Mathematical Reasoning,https://arxiv.org/abs/2407.00782,2024-06-30,2024-07-03
Towards Faster Matrix Diagonalization with Graph Isomorphism Networks and the AlphaZero Framework,https://arxiv.org/abs/2407.00779,2024-06-30,2024-07-03
Structured and Balanced Multi-component and Multi-layer Neural Networks,https://arxiv.org/abs/2407.00765,2024-06-30,2024-07-03
Characterizing Stereotypical Bias from Privacy-preserving Pre-Training,https://arxiv.org/abs/2407.00764,2024-06-30,2024-07-03
Guarding a Target Area from a Heterogeneous Group of Cooperative Attackers,https://arxiv.org/abs/2407.00762,2024-06-30,2024-07-03
Improving the performance of Stein variational inference through extreme sparsification of physically-constrained neural network models,https://arxiv.org/abs/2407.00761,2024-06-30,2024-07-03
Improved Graph-based semi-supervised learning Schemes,https://arxiv.org/abs/2407.00760,2024-06-30,2024-07-03
Self-consistent Deep Geometric Learning for Heterogeneous Multi-source Spatial Point Data Prediction,https://arxiv.org/abs/2407.00748,2024-06-30,2024-07-03
A Comparative Study of Quality Evaluation Methods for Text Summarization,https://arxiv.org/abs/2407.00747,2024-06-30,2024-07-03
Posterior Sampling with Denoising Oracles via Tilted Transport,https://arxiv.org/abs/2407.00745,2024-06-30,2024-07-03
PolygonGNN - Representation Learning for Polygonal Geometries with Heterogeneous Visibility Graph,https://arxiv.org/abs/2407.00742,2024-06-30,2024-07-03
Diffusion Models for Offline Multi-agent Reinforcement Learning with Safety Constraints,https://arxiv.org/abs/2407.00741,2024-06-30,2024-07-03
"Locate&Edit - Energy-based Text Editing for Efficient, Flexible, and Faithful Controlled Text Generation",https://arxiv.org/abs/2407.00740,2024-06-30,2024-07-03
Engineering an Efficient Object Tracker for Non-Linear Motion,https://arxiv.org/abs/2407.00738,2024-06-30,2024-07-03
Generative prediction of flow field based on the diffusion model,https://arxiv.org/abs/2407.00735,2024-06-30,2024-07-03
Large Language Models Struggle in Token-Level Clinical Named Entity Recognition,https://arxiv.org/abs/2407.00731,2024-06-30,2024-07-03
D-CDLF - Decomposition of Common and Distinctive Latent Factors for Multi-view High-dimensional Data,https://arxiv.org/abs/2407.00730,2024-06-30,2024-07-03
A Whole-Process Certifiably Robust Aggregation Method Against Backdoor Attacks in Federated Learning,https://arxiv.org/abs/2407.00719,2024-06-30,2024-07-03
Learning System Dynamics without Forgetting,https://arxiv.org/abs/2407.00717,2024-06-30,2024-07-03
Heterogeneous Graph Contrastive Learning with Spectral Augmentation,https://arxiv.org/abs/2407.00708,2024-06-30,2024-07-03
Sum-of-norms regularized Nonnegative Matrix Factorization,https://arxiv.org/abs/2407.00706,2024-06-30,2024-07-03
Scaling Technology Acceptance Analysis with Large Language Model (LLM) Annotation Systems,https://arxiv.org/abs/2407.00702,2024-06-30,2024-07-03
Tackling Long-Horizon Tasks with Model-based Offline Reinforcement Learning,https://arxiv.org/abs/2407.00699,2024-06-30,2024-07-03
NourishNet - Proactive Severity State Forecasting of Food Commodity Prices for Global Warning Systems,https://arxiv.org/abs/2407.00698,2024-06-30,2024-07-03
CaFNet - A Confidence-Driven Framework for Radar Camera Depth Estimation,https://arxiv.org/abs/2407.00697,2024-06-30,2024-07-03
Graph in Graph Neural Network,https://arxiv.org/abs/2407.00696,2024-06-30,2024-07-03
Learning Formal Mathematics From Intrinsic Motivation,https://arxiv.org/abs/2407.00695,2024-06-30,2024-07-03
BAPO - Base-Anchored Preference Optimization for Personalized Alignment in Large Language Models,https://arxiv.org/abs/2407.00693,2024-06-30,2024-07-03
Emergent Crowd Grouping via Heuristic Self-Organization,https://arxiv.org/abs/2407.00674,2024-06-30,2024-07-03
Establishing Deep InfoMax as an effective self-supervised learning methodology in materials informatics,https://arxiv.org/abs/2407.00671,2024-06-30,2024-07-03
HRDE - Retrieval-Augmented Large Language Models for Chinese Health Rumor Detection and Explainability,https://arxiv.org/abs/2407.00668,2024-06-30,2024-07-03
Multi-Agent Training for Pommerman - Curriculum Learning and Population-based Self-Play Approach,https://arxiv.org/abs/2407.00662,2024-06-30,2024-07-03
Improving Real-Time Music Accompaniment Separation with MMDenseNet,https://arxiv.org/abs/2407.00657,2024-06-30,2024-07-03
Commute Graph Neural Networks,https://arxiv.org/abs/2407.01635,2024-06-30,2024-07-03
Chain-of-Knowledge - Integrating Knowledge Reasoning into Large Language Models by Learning from Knowledge Graphs,https://arxiv.org/abs/2407.00653,2024-06-30,2024-07-03
Particle Semi-Implicit Variational Inference,https://arxiv.org/abs/2407.00649,2024-06-30,2024-07-03
LegalTurk Optimized BERT for Multi-Label Text Classification and NER,https://arxiv.org/abs/2407.00648,2024-06-30,2024-07-03
Clusterpath Gaussian Graphical Modeling,https://arxiv.org/abs/2407.00644,2024-06-30,2024-07-03
HASNAS - A Hardware-Aware Spiking Neural Architecture Search Framework for Neuromorphic Compute-in-Memory Systems,https://arxiv.org/abs/2407.00641,2024-06-30,2024-07-03
A Collocation-based Method for Addressing Challenges in Word-level Metric Differential Privacy,https://arxiv.org/abs/2407.00638,2024-06-30,2024-07-03
DP-MLM - Differentially Private Text Rewriting Using Masked Language Models,https://arxiv.org/abs/2407.00637,2024-06-30,2024-07-03
Tarsier - Recipes for Training and Evaluating Large Video Description Models,https://arxiv.org/abs/2407.00634,2024-06-30,2024-07-03
CAMON - Cooperative Agents for Multi-Object Navigation with LLM-based Conversations,https://arxiv.org/abs/2407.00632,2024-06-30,2024-07-03
Identification of LFT Structured Descriptor Systems with Slow and Non-uniform Sampling,https://arxiv.org/abs/2407.00629,2024-06-30,2024-07-03
Maximum Entropy Inverse Reinforcement Learning of Diffusion Models with Energy-Based Models,https://arxiv.org/abs/2407.00626,2024-06-30,2024-07-03
Iterative Nash Policy Optimization - Aligning LLMs with General Preferences via No-Regret Learning,https://arxiv.org/abs/2407.00617,2024-06-30,2024-07-03
GC-Bench - An Open and Unified Benchmark for Graph Condensation,https://arxiv.org/abs/2407.00615,2024-06-30,2024-07-03
A Linear Programming Enhanced Genetic Algorithm for Hyperparameter Tuning in Machine Learning,https://arxiv.org/abs/2407.00613,2024-06-30,2024-07-03
Diff-BBO - Diffusion-Based Inverse Modeling for Black-Box Optimization,https://arxiv.org/abs/2407.00610,2024-06-30,2024-07-03
ESGNN - Towards Equivariant Scene Graph Neural Network for 3D Scene Understanding,https://arxiv.org/abs/2407.00609,2024-06-30,2024-07-03
Efficient Personalized Text-to-image Generation by Leveraging Textual Subspace,https://arxiv.org/abs/2407.00608,2024-06-30,2024-07-03
Parm - Efficient Training of Large Sparsely-Activated Models with Dedicated Schedules,https://arxiv.org/abs/2407.00599,2024-06-30,2024-07-03
Hyperparameter Optimization for Randomized Algorithms - A Case Study for Random Features,https://arxiv.org/abs/2407.00584,2024-06-30,2024-07-03
MasonTigers at SemEval-2024 Task 10 - Emotion Discovery and Flip Reasoning in Conversation with Ensemble of Transformers and Prompting,https://arxiv.org/abs/2407.00581,2024-06-30,2024-07-03
Learning to Control Unknown Strongly Monotone Games,https://arxiv.org/abs/2407.00575,2024-06-30,2024-07-03
Adversarial Online Learning with Temporal Feedback Graphs,https://arxiv.org/abs/2407.00571,2024-06-30,2024-07-03
Investigating and Mitigating the Multimodal Hallucination Snowballing in Large Vision-Language Models,https://arxiv.org/abs/2407.00569,2024-06-30,2024-07-03
Divide And Conquer - Learning Chaotic Dynamical Systems With Multistep Penalty Neural Ordinary Differential Equations,https://arxiv.org/abs/2407.00568,2024-06-30,2024-07-03
A Contextual Combinatorial Bandit Approach to Negotiation,https://arxiv.org/abs/2407.00567,2024-06-30,2024-07-03
Accelerating Longitudinal MRI using Prior Informed Latent Diffusion,https://arxiv.org/abs/2407.00537,2024-06-29,2024-07-03
Interpreting Pretrained Speech Models for Automatic Speech Assessment of Voice Disorders,https://arxiv.org/abs/2407.00531,2024-06-29,2024-07-03
